, ,url,title,summary,claimant,verdict,party,topic,sub category,date_published,creator,publisher,license_type,copyright,verdict_simplified,date,number_articles_newsbank
404,10696844.0,https://www.abc.net.au/news/10696844,Does Labor have twice the number of women the Liberals have in Parliament and on the frontbench?,"Deputy Opposition Leader Tanya Plibersek claims that Labor is well ahead of the Liberal Party when it comes to female representation, with more than double the number of women in its parliamentary party, and double the number of women on its frontbench.",Tanya Plibersek,"Yes, but more to it",Labor,Employment,Equal Opp,Thu Feb 07 06:03:51 EST 2019,RMIT ABC Fact Check,Australian Broadcasting Corporation,All rights reserved,2000 ABC,Positive,2019-02-07 06:03:51,0
405,10780846.0,https://www.abc.net.au/news/10780846,Are five MCGs of native forest being logged in Victoria every day?,"Environmentalists frequently talk about logging in terms of how many ""football fields"" or ""soccer pitches"" are felled. But in the lead up to the 2018 Victorian state election, the Greens released a policy paper that measured logging in a slightly different way: MCGs. ",Greens,Close to the mark,Greens,Environment,,"20 Feb 2019, 4:01pm",RMIT ABC Fact Check,Australian Broadcasting Corporation,All rights reserved,2000 ABC,Positive,2019-02-20 16:01:00,0
406,10798654.0,https://www.abc.net.au/news/10798654,Fact check: Could Richard Di Natale and Bob Brown act as medical advisers on the transfer of refugees under proposed legislation?,"As the Government seeks to prevent the passage of the so-called ""medevac bill"", Home Affairs Minister Peter Dutton has questioned the influence medical practitioners would have in deciding to transfer sick refugees to Australia for treatment, suggesting that Greens politicians could be qualified to provide the medical advice used to justify a transfer.",Peter Dutton,Drawing a long bow,Liberal,Immigration,"legistlation, Asylum seekers",Mon Feb 11 15:51:02 EST 2019,RMIT ABC Fact Check,Australian Broadcasting Corporation,All rights reserved,2000 ABC,In_Between,2019-02-11 15:51:02,0
407,10821084.0,http://www.abc.net.au/news/2019-02-22/fact-check-have-homeownership-rates-for-young-people-dropped/10821084,Labor says the home ownership rate for young people has fallen 20 per cent. Is that right?,"Keeping to Labor's theme of economic inequality in the leadup to the 2019 federal election, Shadow Treasurer Chris Bowen claims home ownership rates for people aged 25-34 have ""spiralled downwards in recent years"".",Chris Bowen,In the ballpark,Labor,Economy,,"22 Feb 2019, 6:21am",RMIT ABC Fact Check,Australian Broadcasting Corporation,All rights reserved,2000 ABC,,2019-02-22 06:21:00,0
408,10845696.0,http://www.abc.net.au/news/2019-02-26/fact-check-does-labors-capital-gains-tax-policy-frydenberg/10845696,"Labor's capital gains changes will hurt those on less than $80,000, Josh Frydenberg says. Is that right?","Treasurer Josh Frydenberg says Labor's proposed 50 per cent capital gains tax increase will hit not only the economy but also taxpayers on low-to-middle incomes, and claims that more than 60 per cent of people who declare capital gains have taxable incomes of less than $80,000.",Josh Frydenberg,Misleading,Liberal,Economy,Capital gains,"26 Feb 2019, 6:27am",RMIT ABC Fact Check,Australian Broadcasting Corporation,All rights reserved,2000 ABC,,2019-02-26 06:27:00,0
409,10824996.0,http://www.abc.net.au/news/2019-02-28/fact-check-crimes-against-humanity-wilkie-nauru-manus-refugees/10824996,"By sending asylum seekers to Nauru and Manus, is Australia guilty of crimes against humanity?","Independent MP Andrew Wilkie has condemned successive Australian governments for failing to meet their obligations under international law to asylum seekers and refugees who arrive by sea, and says the Government has committed crimes against humanity.",Andrew Wilkie,Untested,Independent,Immigration,Asylum seekers,"28 Feb 2019, 9:03am",RMIT ABC Fact Check,Australian Broadcasting Corporation,All rights reserved,2000 ABC,,2019-02-28 09:03:00,0
410,10839222.0,http://www.abc.net.au/news/2019-03-01/fact-check-medevac-refugees-offshore-coleman/10839222,Will the medevac bill allow healthy refugees on Nauru and Manus to come to Australia?,"Immigration Minister David Coleman has criticised the so-called ""medevac bill"", claiming the legislation requires a ""very, very low threshold"" for bringing refugees and asylum seekers to Australia from Manus Island and Nauru.",David Coleman,Spin,Liberal,Immigration,Asylum seekers,"1 Mar 2019, 8:57am",RMIT ABC Fact Check,Australian Broadcasting Corporation,All rights reserved,2000 ABC,,2019-03-01 08:57:00,0
411,10861688.0,http://www.abc.net.au/news/2019-03-04/analysis-claims-labor-big-tax-policies-misleading/10861688,"Analysis: Why using taxable income to attack Labor's negative gearing, capital gains and dividend imputation policies is misleading","In the lead up to the 2019 federal election, RMIT ABC Fact Check examines how tax data is being used in the public policy debate.",,,Liberal,Taxation,,"4 Mar 2019, 7:15am",RMIT ABC Fact Check,Australian Broadcasting Corporation,All rights reserved,2000 ABC,,2019-03-04 07:15:00,0
412,10867388.0,https://www.abc.net.au/news/2019-03-06/fact-chec-nsw-votes-jobless-rate-46-per-cent-higher-under-labor/10867388,Dominic Perrottet says unemployment in NSW was nearly 50 per cent higher under Labor. Is he correct?,"In the lead up to the 2019 state election, NSW Treasurer Dominic Perrottet has taken credit for the state's solid employment figures, arguing that Labor would take the state backwards and claiming that unemployment was much higher 10 years ago.",Dominic Perottet,Cherrypicking,Liberal,Employment,,"6 Mar 2019, 9:08am",RMIT ABC Fact Check,Australian Broadcasting Corporation,All rights reserved,2000 ABC,,2019-03-06 09:08:00,0
413,10872362.0,https://www.abc.net.au/news/2019-03-07/fact-check-greens-nsw-homelessness-increase-housing-nsw-election/10872362,"Housing is an election issue for the NSW Greens, but is homelessness up 30 per cent as they say?","Arguing there is a ""housing crisis"" in the state, NSW Greens MP David Shoebridge claims that homelessness in NSW ""has jumped by more than 30 per cent in five years"".",David Shoebridge,Close to the mark,Greens,Housing,Homelessness,"7 Mar 2019, 11:45am",RMIT ABC Fact Check,Australian Broadcasting Corporation,All rights reserved,2000 ABC,,2019-03-07 11:45:00,0
414,10882844.0,https://www.abc.net.au/news/2019-03-08/fact-check-fact-check-international-womens-day-2019/10882844,"Analysis: As International Women's Day rolls around again, what's changed for women in Australia?","Since International Women's Day in 2018, RMIT ABC Fact Check has investigated a slew of claims relating to women and their place in Australian society and politics. This article summarises the findings.

",,,,Immigration,,"8 Mar 2019, 2:44pm",RMIT ABC Fact Check,Australian Broadcasting Corporation,All rights reserved,2000 ABC,,2019-03-08 14:44:00,0
415,10900474.0,http://www.abc.net.au/news/2019-03-15/fact-check-dutton-refugees-hospital-beds/10900474,The Government says Australians will lose out on medical help if refugees are brought here for treatment. Is that correct?,Prime Minister Scott Morrison and other Coalition frontbenchers say Australians face being kicked off hospital waiting lists by an influx of asylum seekers and refugees seeking medical treatment in Australia under the so-called medevac legislation.,Multiple,Baseless,Liberal,Immigration,"Health, Hospitals","15 Mar 2019, 9:36am",RMIT ABC Fact Check,Australian Broadcasting Corporation,All rights reserved,2000 ABC,,2019-03-15 09:36:00,0
416,10892542.0,https://www.abc.net.au/news/2019-03-18/fact-check-nsw-election-school-closures-openings-daley/10892542,Michael Daley says NSW Government has closed more schools than it has opened. Is he correct?,"Announcing NSW Labor's plan to replace 1,000 demountable classrooms with permanent buildings, Opposition Leader Michael Daley says the state government has failed to build new ""bricks and mortar classrooms for eight long years"".",Michael Daley,Spin,Labor,Education,,"18 Mar 2019, 9:06am",RMIT ABC Fact Check,Australian Broadcasting Corporation,All rights reserved,2000 ABC,,2019-03-18 09:06:00,0
417,10910988.0,https://www.abc.net.au/news/2019-03-21/fact-check-nsw-votes-2019-domestic-violence-shelter-cuts/10910988,Fact Check: Did the NSW Coalition cut $20 million from domestic violence shelters?,"NSW Opposition Leader Michael Daley says that, if elected, Labor will boost funding for domestic violence services, and claims that the state Coalition cut $20 million from specialist shelters in 2014.",Michael Daley,Oversimplified,Labor,Social Issues,Domestic Violence,"21 Mar 2019, 8:54am",RMIT ABC Fact Check,Australian Broadcasting Corporation,All rights reserved,2000 ABC,,2019-03-21 08:54:00,0
418,10919640.0,http://www.abc.net.au/news/2019-03-22/fact-check-nsw-votes-solar-power-usage/10919640,Gladys Berejiklian says the largest use of solar energy is in NSW. Is she correct?,"During a NSW leaders' debate, Premier Gladys Berejiklian sought to establish her government's credentials on renewable energy by claiming that NSW has ""the largest  use of solar energy"".",Berejiklian,Doesn't Check Out,Liberal,Environment,Renewables,"22 Mar 2019, 8:58am",RMIT ABC Fact Check,Australian Broadcasting Corporation,All rights reserved,2000 ABC,,2019-03-22 08:58:00,0
419,10950644.0,http://www.abc.net.au/news/2019-03-29/fact-check-labor-shorten-aged-care-misleading-claim/10950644,Bill Shorten says the Government has cut nearly $2 billion from aged-care services. Is he correct?,"Weeks out from the 2019 federal election, Labor has attacked the Government over cuts to aged-care funding, which Opposition Leader Bill Shorten claims amount to nearly $2 billion.",Bill Shorten,Misleading,Liberal,Social Issues,Aged Care,"29 Mar 2019, 10:29am",RMIT ABC Fact Check,Australian Broadcasting Corporation,All rights reserved,2000 ABC,,2019-03-29 10:29:00,0
420,10975460.0,http://www.abc.net.au/news/2019-04-08/fact-check-mediicare-out-of-pocket-costs-kristina-kenneally/10975460,Kristina Keneally says out-of-pocket costs to visit a GP have gone up 25 per cent under the Coalition Government. Is she correct?,"A tweet by Labor Senator Kristina Keneally claims that, under the Morrison government, out-of-pocket costs to visit a GP are up by 25 per cent and out-of-pocket costs to visit a specialist are up by 40 per cent due to the Medicare freeze.",Kristina Keneally,More to the story,Labor,Health,"Medicare, bulk billing","8 Apr 2019, 6:35am",RMIT ABC Fact Check,Australian Broadcasting Corporation,All rights reserved,2000 ABC,,2019-04-08 06:35:00,0
421,10980718.0,http://www.abc.net.au/news/2019-04-09/fact-check-greg-hunt-health-costs-half-baked/10980718,Health Minister Greg Hunt said the bulk-billing rate is up and fewer patients have costs when they see a GP. Is he correct?,"Federal Health Minister Greg Hunt claims that GP bulk-billing rates have risen nearly four percentage points, up from 82.2 per cent under Labor to a record 86.1 per cent under the Coalition Government.",Greg Hunt,Half Baked,Liberal,Health,"Medicare, bulk billing","9 Apr 2019, 6:32am",RMIT ABC Fact Check,Australian Broadcasting Corporation,All rights reserved,2000 ABC,,2019-04-09 06:32:00,0
422,10936652.0,http://www.abc.net.au/news/2019-04-11/fact-check-coalition-emissions-reduction-angus-taylor/10936652,Energy Minister Angus Taylor said greenhouse gas emissions have turned around by 1.1 billion tonnes under the Coalition. Is he correct?,"Energy Minister Angus Taylor claims that when the Coalition came to power, it inherited a 755 million tonne emissions ""deficit"" against Australia's second Kyoto target because Labor ""hadn't done the hard work"".",Angus Taylor,Misleading,Liberal,Environment,"Emissions, Energy, Renewables","11 Apr 2019, 6:28am",RMIT ABC Fact Check,Australian Broadcasting Corporation,All rights reserved,2000 ABC,,2019-04-11 06:28:00,0
423,11020106.0,https://www.abc.net.au/news/2019-04-16/fact-check-analysis-emissions-morrison-taylor/11020106,Analysis: Why the Coalition is misleading on meeting Australia's Kyoto 2020 carbon emissions target,"The Morrison Government has long claimed Australia is on track to meet its international greenhouse gas emissions targets ""in a canter"". The key to assessing this claim involves understanding how the Department of Environment and Energy has calculated the emissions cuts needed.",,,Liberal,Environment,"Emissions, Energy, Renewables","16 Apr 2019, 3:25pm",RMIT ABC Fact Check,Australian Broadcasting Corporation,All rights reserved,2000 ABC,,2019-04-16 15:25:00,0
424,10983688.0,https://www.abc.net.au/news/2019-04-17/fact-check-actu-sally-mcmanus-insecure-work/10983688,The ACTU's Sally McManus said Australia has the highest rate of temporary work in the OECD. Is she correct?,"As wages growth and job insecurity loom large in the 2019 election campaign, Secretary of the Australian Council of Trade Unions Sally McManus claims that Australia is at risk of morphing into an ""Americanised economy"" of low wages and poor job security.",Unions Sally McManus,Not clear cut,Union,Employment,"Temporary work, OECD","17 Apr 2019, 9:11am",RMIT ABC Fact Check,Australian Broadcasting Corporation,All rights reserved,2000 ABC,,2019-04-17 09:11:00,0
425,10979770.0,https://www.abc.net.au/news/2019-04-18/fact-check-can-algorithms-screen-out-hate-content-social-media/10979770,Scott Morrison said hate content on social media could be automatically screened out by algorithms. Is he correct?,"The Federal Government has put social media companies on notice after the Christchurch massacre for failing to prevent the shooter's actions being broadcast and promoted online. But can algorithms automatically block hate content, as the Prime Minister claims?",Scott Morrison,Wishful thinking,Liberal,Social Media,"Algoriths, Facebook, Terrorism","18 Apr 2019, 6:19am",RMIT ABC Fact Check,Australian Broadcasting Corporation,All rights reserved,2000 ABC,,2019-04-18 06:19:00,0
426,11029284.0,https://www.abc.net.au/news/2019-04-24/fact-check-bradfield-scheme-barnaby-joyce-drought/11029284,Barnaby Joyce said building the Bradfield Scheme to redirect water is the one thing Australia can do to reduce the effects of drought. Is he correct?,"Former Nationals leader Barnaby Joyce says ""the one thing we can do"" to reduce the effects of drought is introduce the Bradfield Scheme, an ambitious plan from the 1930s aimed at diverting floodwaters from the north of the country inland.",Barnaby Joyce,Pie in the Sky,National_Party,Environment,"Water Security, Irrigation, Drought, Elections","24 Apr 2019, 7:11am",RMIT ABC Fact Check,Australian Broadcasting Corporation,All rights reserved,2000 ABC,,2019-04-24 07:11:00,0
427,11003182.0,https://www.abc.net.au/news/2019-04-26/fact-check-did-labor-oppose-the-government-gun-reforms/11003182,Fact Check: Did Labor oppose the Government's attempts to strengthen Australia's gun laws?,"Attorney-General Christian Porter claims that the Government has twice tried to pass increased penalties and mandatory minimum penalties for gun traffickers, but they were opposed by Labor.",Christian Porter,Yes and No,Liberal,Social Issues,"Gun laws, Minimum sentences","26 Apr 2019, 9:53am",RMIT ABC Fact Check,Australian Broadcasting Corporation,All rights reserved,2000 ABC,,2019-04-26 09:53:00,0
428,11049364.0,https://www.abc.net.au/news/2019-04-29/fact-check-apprenticeships-drop-claim-bill-shorten/11049364,Labor leader Bill Shorten says the number of apprenticeships has slumped since the Coalition took office. Is he correct?,"Opposition Leader Bill Shorten says the Government is to blame for a drop in the number of apprenticeships, claiming there were 420,000 before the Coalition came to power but that now, in 2019, there are fewer than 280,000.",Bill Shorten,Misleading,Liberal,Employment,"Apprenticeships, Traineeships, Elections","29 Apr 2019, 7:13am",RMIT ABC Fact Check,Australian Broadcasting Corporation,All rights reserved,2000 ABC,,2019-04-29 07:13:00,0
429,11056388.0,https://www.abc.net.au/news/2019-04-29/fact-check-perth-leaders-debate/11056388,Analysis: Fact checking key claims of the 2019 federal election leaders' debate,"In leaders' debates held in the run up to federal elections, is the more persuasive leader also the more accurate? RMIT ABC Fact Check looked at some of the key claims made during the first leaders' debate of the 2019 federal election.",,,Multiple Parties,Economy,"Leaders' debate, Elections","29 Apr 2019, 11:02pm",RMIT ABC Fact Check,Australian Broadcasting Corporation,All rights reserved,2000 ABC,,2019-04-29 23:02:00,3
430,11055074.0,https://www.abc.net.au/news/2019-05-01/fact-check-morrison-police-investment-properties/11055074,Scott Morrison says police officers who own an investment property have just one. Is he correct?,"Scott Morrison has lambasted Labor's proposed changes to negative gearing and capital gains tax, using police officers as an example of those who may be affected. ""I do know that one in five police officers have an investment property,"" the Prime Minister said.",Scott Morrison,Fair call,Liberal,Housing,"Negative gearing, Capital gains, Investment properties, Economy","1 May 2019, 8:54am",RMIT ABC Fact Check,Australian Broadcasting Corporation,All rights reserved,2000 ABC,,2019-05-01 08:54:00,0
431,11053996.0,https://www.abc.net.au/news/2019-05-02/fact-check-has-the-minimum-wage-increased-frydenberg/11053996,Josh Frydenberg told Q&A the minimum wage has been growing at a faster rate than inflation and the average wage. Is he correct?,Treasurer Josh Frydenberg claims that workers on the minimum wage have fared better under the Coalition than when Labor was last in government.,Josh Frydenberg,Fair call,Liberal,Wages,"Minimum Wages, Elections, Employment, Workers","2 May 2019, 9:51am",RMIT ABC Fact Check,Australian Broadcasting Corporation,All rights reserved,2000 ABC,,2019-05-02 09:51:00,0
432,11072962.0,https://www.abc.net.au/news/2019-05-03/fact-check-electric-cars-australia-vs-oecd/11072962,"Labor's Climate Change Spokesman, Mark Butler, says Australia has the lowest uptake of electric vehicles in the OECD. Is he correct?","Labor has promised to introduce the nation's first national electric vehicle policy if elected. Climate change spokesman Mark Butler says the policy, which aims to make half of new car sales electric by 2030, would see Australia ""start to catch up with the rest of the world"".",Mark Butler,Close to the mark,Labor,Transport,"Electric vehicles, climate change, environment, emissions","3 May 2019, 11:38am",RMIT ABC Fact Check,Australian Broadcasting Corporation,All rights reserved,2000 ABC,,2019-05-03 11:38:00,0
433,11079120.0,https://www.abc.net.au/news/2019-05-03/fact-checking-the-second-leaders-debate-ausvotes2019/11079120,Analysis: Federal election 2019: RMIT ABC Fact Check runs the rule over Scott Morrison and Bill Shorten's second debate,RMIT ABC Fact Check looked at some of the key claims made during the second leaders' debate of the 2019 federal election.,,,Multiple Parties,Economy,"Leaders' debate, Elections","3 May 2019, 9:35pm",RMIT ABC Fact Check,Australian Broadcasting Corporation,All rights reserved,2000 ABC,,2019-05-03 21:35:00,0
434,11084344.0,https://www.abc.net.au/news/2019-05-06/zombie3a-dividend-imputation/11084344,Fact Check Zombie: Josh Frydenberg repeats misleading claim on franking credits,"Treasurer Josh Frydenberg and Assistant Treasurer Stuart Robert have both claimed that more than 80 per cent of people who are relying on their cash refunds from excess franking credits have a taxable income under $37,000.",,,Liberal,Economy,"Elections, Franking credits","6 May 2019, 4:56pm",RMIT ABC Fact Check,Australian Broadcasting Corporation,All rights reserved,2000 ABC,,2019-05-06 16:56:00,1
435,11093862.0,https://www.abc.net.au/news/2019-05-08/federal-election-fact-checking-third-leaders-debate/11093862,Analysis: Fact checking the third leaders debate,RMIT ABC Fact Check looked at some of the key claims made during the third leaders' debate of the 2019 federal election.,,,Multiple Parties,Economy,"Leaders' debate, Elections","8 May 2019, 11:09pm",RMIT ABC Fact Check,Australian Broadcasting Corporation,All rights reserved,2000 ABC,,2019-05-08 23:09:00,16
436,11056180.0,https://www.abc.net.au/news/2019-05-08/fact-check-greens-coalition-spending-on-climate-change/11056180,Fact Check: Is the Coalition's new spending on climate change worth just four weeks of keeping Christmas Island open?,"Greens Leader Richard Di Natale claims the Morrison government is spending ""almost as much to keep Christmas Island open in the previous four weeks as they will spend in new money over the next four years on climate change.""",Richard Di Natale,Overblown,Greens,Environment,"Climate change, funding, Christmas island, Asylum seekers","8 May 2019, 6:52am",RMIT ABC Fact Check,Australian Broadcasting Corporation,All rights reserved,2000 ABC,,2019-05-08 06:52:00,0
437,11092856.0,https://www.abc.net.au/news/2019-05-09/federal-election-fact-check-cost-of-coalition-tax-cuts/11092856,"Fact Check: Will $77 billion worth of Coalition tax cuts go to people on $180,000+?","Opposition Leader Bill Shorten has claimed that, over the decade, $77 billion of the Government's tax package would go to the top three per cent of earners.",Bill Shorten,Justifiable,Labor,Taxation,"Tax cuts, Elections, Economy","9 May 2019, 2:45pm",RMIT ABC Fact Check,Australian Broadcasting Corporation,All rights reserved,2000 ABC,,2019-05-09 14:45:00,9
438,11078464.0,https://www.abc.net.au/news/2019-05-10/federal-election-fact-check-electric-vehicle-tow-boat/11078464,Prime Minister Scott Morrison says an electric vehicle can't tow a boat or trailer. Is he correct?,"Prime Minister Scott Morrison says Labor's plan to accelerate the uptake of electric vehicles would ""end the weekend"",  and claims that electric vehicles are not powerful enough to tow trailers and boats.",Scott Morrison,In need of a tune up,Liberal,Transport,"Electric vehicles, climate change, environment, emissions, Electric cars","10 May 2019, 9:23am",RMIT ABC Fact Check,Australian Broadcasting Corporation,All rights reserved,2000 ABC,,2019-05-10 09:23:00,16
439,11084514.0,https://www.abc.net.au/news/2019-05-12/federal-election-fact-check-coalition-cuts-public-school-funding/11084514,Labor says Scott Morrison cut $14 billion from public schools while treasurer. Is that correct?,"Labor claims that the Coalition Government axed funding for public schools by $14 billion, an accusation it has pushed through a campaign website.",Tanya Plibersek,Misleading,Labor,Education,"Cuts, Budget cuts, public schools","12 May 2019, 9:08am",RMIT ABC Fact Check,Australian Broadcasting Corporation,All rights reserved,2000 ABC,,2019-05-12 09:08:00,0
440,11102694.0,https://www.abc.net.au/news/2019-05-13/federal-election-fact-check-underemployment-shorten/11102694,Bill Shorten says a million Australians are doing two jobs and a million are underemployed. Is he correct?,"Opposition Leader Bill Shorten has bemoaned the extent of underemployment in Australia and the prevalence of ""second jobs"" during the first leaders' debate of the 2019 election.",Bill Shorten,Correct,Labor,Employment,"Jobs, Underemployment, Insecure work","13 May 2019, 9:17am",RMIT ABC Fact Check,Australian Broadcasting Corporation,All rights reserved,2000 ABC,,2019-05-13 09:17:00,0
441,11072026.0,https://www.abc.net.au/news/2019-05-16/federal-election-fact-check-wages-first-debate-bill-shorten/11072026,Bill Shorten says everything is going up except your wages. Is he correct?,"In the first leaders' debate of the 2019 election, Opposition Leader Bill Shorten has claimed wages growth under the Coalition is at record lows while living costs are rising across the board.",Bill Shorten,Doesn't stack up,Labor,Social Issues,"Wages, Salaries, Childcare, Economy, Medicare","16 May 2019, 6:41am",RMIT ABC Fact Check,Australian Broadcasting Corporation,All rights reserved,2000 ABC,,2019-05-16 06:41:00,0
442,11108108.0,https://www.abc.net.au/news/2019-05-14/federal-election-fact-check-clive-palmer-zombie/11108108,Fact Check Zombie: Clive Palmer repeats improbable claim on tax payments and economic stimulus,Clive Palmer's United Australia Party has repeatedly claimed that if companies paid their tax once a year  instead of in quarterly instalments  there would be an additional $70 billion available each year in Australia's economy.,,,United_Australia_Party,Taxation,"Tax payment, Economic stimulus, Economy","14 May 2019, 9:31am",RMIT ABC Fact Check,Australian Broadcasting Corporation,All rights reserved,2000 ABC,,2019-05-14 09:31:00,0
443,11111848.0,https://www.abc.net.au/news/2019-05-15/federal-election-fact-check-childcare-costs/11111848,Labor says childcare costs have gone up 28 per cent under the Coalition. Is that correct?,"In the leadup to the 2019 election, Labor Opposition Leader Bill Shorten says wages are stagnant yet living costs keep rising, and claims that since the Coalition came to power, child care costs have increased by 28 per cent.",Bill Shorten,In the ballpark,Labor,Wages,"Wage growth, Wages, Economy, Election ","15 May 2019, 9:39am",RMIT ABC Fact Check,Australian Broadcasting Corporation,All rights reserved,2000 ABC,,2019-05-15 09:39:00,0
